{
  "operation_id": "op_01JAV3QK2M0000000000000011",
  "runner": "headspace",
  "runner_revision": "sha256:26951e7ab41e0d560d84c11d196fb79378c4f4f5986392115bb7ca48009e1677",
  "workspace": {
    "source_ref": "artifact://workspace/input",
    "source_digest": "sha256:104c92af170b72888c5be5b64aa08aff686010ae232cd101b8c1c61f7eff0636",
    "write_mode": "copy-on-write"
  },
  "execution": {
    "kind": "container",
    "image_ref": "registry.example/test-runner",
    "image_digest": "sha256:0604fdb7edd7a8eacbcbdebdf7aad00db03650efd7f927f4b16f6cd0e0c3747e",
    "user": "65532:65532",
    "read_only_root": true
  },
  "command": {
    "argv": [
      "python",
      "-m",
      "pytest",
      "-q"
    ],
    "working_directory": "/workspace",
    "environment_refs": [],
    "requires_shell": false
  },
  "policy": {
    "timeout_seconds": 900,
    "cpu": 2,
    "memory_mib": 2048,
    "pids": 256,
    "network": "none",
    "allowed_output_paths": [
      "/workspace"
    ]
  },
  "evidence": {
    "snapshot_before": true,
    "snapshot_after": true,
    "capture_exit": true,
    "capture_logs": true,
    "capture_resource_usage": true
  },
  "context": {
    "run_id": "run_01JAV3QK2M0000000000000001",
    "node_run_id": "nr_01JAV3QK2M0000000000000008",
    "attempt_id": "att_01JAV3QK2M0000000000000010"
  }
}
